{
  "schema_version": "1.0",
  "request_id": "example-pip-resolve",
  "trace_id": "example-pip-resolve-trace",
  "status": "ok",
  "ecosystem": "pip",
  "resolver": {
    "name": "pip-dependency-resolver",
    "adapter_version": "container-v1",
    "backend_version": "python-backend-v1"
  },
  "result": {
    "root": {
      "id": "pip:requests@2.32.5",
      "ecosystem": "pip",
      "name": "requests",
      "version": "2.32.5"
    },
    "nodes": [
      {
        "id": "pip:requests@2.32.5",
        "ecosystem": "pip",
        "name": "requests",
        "version": "2.32.5",
        "labels": { "scope": "root" },
        "attributes": { "optional": false, "peer": false, "dev": false }
      }
    ],
    "edges": [],
    "semantics": {
      "source": "display_resolution"
    }
  },
  "diagnostics": [],
  "raw": null,
  "timing": {
    "duration_ms": 1
  },
  "metrics": {
    "node_count": 1,
    "edge_count": 0
  }
}
